<?xml version="1.0" encoding="UTF-8"?>
<!DOCTYPE list SYSTEM "../../templates/weapons.dtd">
<list>
  <item id="2915" name="Old Knight Sword">
    <for>
      <set val="24" order="0x08" stat="pAtk"/>
      <set val="17" order="0x08" stat="mAtk"/>
      <set val="8" order="0x08" stat="rCrit"/>
      <add val="0" order="0x10" stat="accCombat"/>
      <set val="379" order="0x08" stat="pAtkSpd"/>
      <enchant val="0" order="0x0C" stat="pAtk"/>
      <enchant val="0" order="0x0C" stat="mAtk"/>
    </for>
  </item>
</list>