<?xml version='1.0' encoding='utf-8'?>
<!DOCTYPE list SYSTEM "weapons.dtd">
<list>
<item id='8203' name="Monster Only(benom_sword)">
  <for>
    <set val='0' order='0x08' stat='pAtk' />
    <set val='10' order='0x08' stat='mAtk' />
    <set val='0' order='0x08' stat='rCrit' />
    <add val='0' order='0x40' stat='accCombat' />
    <set val='325' order='0x08' stat='pAtkSpd' />
    <enchant val='0' order='0x0C' stat='pAtk' />
    <enchant val='0' order='0x0C' stat='mAtk' />
  </for>
</item>
<item id='8204' name="Monster OnlyMonster Only(follower_of_frintessa_calibur)">
  <for>
    <set val='0' order='0x08' stat='pAtk' />
    <set val='10' order='0x08' stat='mAtk' />
    <set val='0' order='0x08' stat='rCrit' />
    <add val='0' order='0x40' stat='accCombat' />
    <set val='379' order='0x08' stat='pAtkSpd' />
    <enchant val='0' order='0x0C' stat='pAtk' />
    <enchant val='0' order='0x0C' stat='mAtk' />
  </for>
</item>
<item id='8205' name="Monster Only(heretic_priest_sickle)">
  <for>
    <set val='0' order='0x08' stat='pAtk' />
    <set val='10' order='0x08' stat='mAtk' />
    <set val='0' order='0x08' stat='rCrit' />
    <add val='0' order='0x40' stat='accCombat' />
    <set val='325' order='0x08' stat='pAtkSpd' />
    <enchant val='0' order='0x0C' stat='pAtk' />
    <enchant val='0' order='0x0C' stat='mAtk' />
  </for>
</item>
<item id='8206' name="Monster Only(heretic_priest_sword)">
  <for>
    <set val='0' order='0x08' stat='pAtk' />
    <set val='10' order='0x08' stat='mAtk' />
    <set val='0' order='0x08' stat='rCrit' />
    <add val='0' order='0x40' stat='accCombat' />
    <set val='325' order='0x08' stat='pAtkSpd' />
    <enchant val='0' order='0x0C' stat='pAtk' />
    <enchant val='0' order='0x0C' stat='mAtk' />
  </for>
</item>
<item id='8207' name="Monster Only(heretic_privates_axe)">
  <for>
    <set val='0' order='0x08' stat='pAtk' />
    <set val='10' order='0x08' stat='mAtk' />
    <set val='0' order='0x08' stat='rCrit' />
    <add val='0' order='0x40' stat='accCombat' />
    <set val='325' order='0x08' stat='pAtkSpd' />
    <enchant val='0' order='0x0C' stat='pAtk' />
    <enchant val='0' order='0x0C' stat='mAtk' />
  </for>
</item>
<item id='8208' name="Monster Only(heretic_privates_staff)">
  <for>
    <set val='0' order='0x08' stat='pAtk' />
    <set val='10' order='0x08' stat='mAtk' />
    <set val='0' order='0x08' stat='rCrit' />
    <add val='0' order='0x40' stat='accCombat' />
    <set val='325' order='0x08' stat='pAtkSpd' />
    <enchant val='0' order='0x0C' stat='pAtk' />
    <enchant val='0' order='0x0C' stat='mAtk' />
  </for>
</item>
<item id='8209' name="Monster Only(lidia_von_helmann_sword)">
  <for>
    <set val='0' order='0x08' stat='pAtk' />
    <set val='10' order='0x08' stat='mAtk' />
    <set val='0' order='0x08' stat='rCrit' />
    <add val='0' order='0x40' stat='accCombat' />
    <set val='379' order='0x08' stat='pAtkSpd' />
    <enchant val='0' order='0x0C' stat='pAtk' />
    <enchant val='0' order='0x0C' stat='mAtk' />
  </for>
</item>
<item id='8210' name="Monster Only(monk_warrior_shield)">
  <for>
    <sub val='8' order='0x40' stat='rEvas' />
    <set val='230' order='0x08' stat='pDef' />
	<set val='230' order='0x08' stat='sDef' />
    <set val='20' order='0x08' stat='rShld' />
    <enchant val='0' order='0x0C' stat='pDef' />
	<enchant val='0' order='0x0C' stat='sDef' />
  </for>
</item>
<item id='8211' name="Monster Only(monk_warrior_sword)">
  <for>
    <set val='0' order='0x08' stat='pAtk' />
    <set val='10' order='0x08' stat='mAtk' />
    <set val='0' order='0x08' stat='rCrit' />
    <add val='0' order='0x40' stat='accCombat' />
    <set val='379' order='0x08' stat='pAtkSpd' />
    <enchant val='0' order='0x0C' stat='pAtk' />
    <enchant val='0' order='0x0C' stat='mAtk' />
  </for>
</item>
<item id='8212' name="Monster Only(solina_brother_mace)">
  <for>
    <set val='0' order='0x08' stat='pAtk' />
    <set val='10' order='0x08' stat='mAtk' />
    <set val='0' order='0x08' stat='rCrit' />
    <add val='0' order='0x40' stat='accCombat' />
    <set val='379' order='0x08' stat='pAtkSpd' />
    <enchant val='0' order='0x0C' stat='pAtk' />
    <enchant val='0' order='0x0C' stat='mAtk' />
  </for>
</item>
<item id='8213' name="Monster Only(solina_father_mace)">
  <for>
    <set val='0' order='0x08' stat='pAtk' />
    <set val='10' order='0x08' stat='mAtk' />
    <set val='0' order='0x08' stat='rCrit' />
    <add val='0' order='0x40' stat='accCombat' />
    <set val='379' order='0x08' stat='pAtkSpd' />
    <enchant val='0' order='0x0C' stat='pAtk' />
    <enchant val='0' order='0x0C' stat='mAtk' />
  </for>
</item>
<item id='8214' name="Monster Only(solina_priest_pole)">
  <for>
    <set val='0' order='0x08' stat='pAtk' />
    <set val='10' order='0x08' stat='mAtk' />
    <set val='0' order='0x08' stat='rCrit' />
    <set val='66' order='0x08' stat='pAtkRange'/>
    <add val='0' order='0x40' stat='accCombat' />
    <set val='325' order='0x08' stat='pAtkSpd' />
    <enchant val='0' order='0x0C' stat='pAtk' />
    <enchant val='0' order='0x0C' stat='mAtk' />
  </for>
</item>
<item id='8215' name="Monster Only(zombie_enlisted_man_sword)">
  <for>
    <set val='0' order='0x08' stat='pAtk' />
    <set val='10' order='0x08' stat='mAtk' />
    <set val='0' order='0x08' stat='rCrit' />
    <add val='0' order='0x40' stat='accCombat' />
    <set val='325' order='0x08' stat='pAtkSpd' />
    <enchant val='0' order='0x0C' stat='pAtk' />
    <enchant val='0' order='0x0C' stat='mAtk' />
  </for>
</item>
<item id='8216' name="Monster Only(zombie_enlisted_man_sword)">
  <for>
    <set val='0' order='0x08' stat='pAtk' />
    <set val='10' order='0x08' stat='mAtk' />
    <set val='4' order='0x08' stat='rCrit' />
    <add val='4' order='0x40' stat='accCombat' />
    <set val='325' order='0x08' stat='pAtkSpd' />
    <enchant val='0' order='0x0C' stat='pAtk' />
    <enchant val='0' order='0x0C' stat='mAtk' />
  </for>
</item>
<item id='8217' name="Monster Only(zombie_gateguard_spear)">
  <for>
    <set val='0' order='0x08' stat='pAtk' />
    <set val='10' order='0x08' stat='mAtk' />
    <set val='8' order='0x08' stat='rCrit' />
    <set val='66' order='0x08' stat='pAtkRange'/>
    <add val='0' order='0x40' stat='accCombat' />
    <set val='379' order='0x08' stat='pAtkSpd' />
    <enchant val='0' order='0x0C' stat='pAtk' />
    <enchant val='0' order='0x0C' stat='mAtk' />
  </for>
</item>
<item id='8218' name="Monster Only(zombie_laborer_axe)">
  <for>
    <set val='0' order='0x08' stat='pAtk' />
    <set val='10' order='0x08' stat='mAtk' />
    <set val='4' order='0x08' stat='rCrit' />
    <add val='4' order='0x40' stat='accCombat' />
    <set val='379' order='0x08' stat='pAtkSpd' />
    <enchant val='0' order='0x0C' stat='pAtk' />
    <enchant val='0' order='0x0C' stat='mAtk' />
  </for>
</item>
<item id='8219' name="Monster Only(zombie_laborer_sword)">
  <for>
    <set val='0' order='0x08' stat='pAtk' />
    <set val='10' order='0x08' stat='mAtk' />
    <set val='8' order='0x08' stat='rCrit' />
    <add val='0' order='0x40' stat='accCombat' />
    <set val='379' order='0x08' stat='pAtkSpd' />
    <enchant val='0' order='0x0C' stat='pAtk' />
    <enchant val='0' order='0x0C' stat='mAtk' />
  </for>
</item>
<item id='8220' name="Monster Only(apostle_grail_bow)">
  <for>
    <set val='0' order='0x08' stat='pAtk' />
    <set val='10' order='0x08' stat='mAtk' />
    <set val='12' order='0x08' stat='rCrit' />
    <add val='-3' order='0x40' stat='accCombat' />
    <set val='293' order='0x08' stat='pAtkSpd' />
    <enchant val='0' order='0x0C' stat='pAtk' />
    <enchant val='0' order='0x0C' stat='mAtk' />
  </for>
</item>
<item id='8221' name="Monster Only(apostle_grail_spear)">
  <for>
    <set val='0' order='0x08' stat='pAtk' />
    <set val='10' order='0x08' stat='mAtk' />
    <set val='8' order='0x08' stat='rCrit' />
    <set val='66' order='0x08' stat='pAtkRange'/>
    <add val='-3' order='0x40' stat='accCombat' />
    <set val='325' order='0x08' stat='pAtkSpd' />
    <enchant val='0' order='0x0C' stat='pAtk' />
    <enchant val='0' order='0x0C' stat='mAtk' />
  </for>
</item>
<item id='8222' name="Monster Only(follower_of_frintessa_tran_calibur)">
  <for>
    <set val='0' order='0x08' stat='pAtk' />
    <set val='10' order='0x08' stat='mAtk' />
    <set val='8' order='0x08' stat='rCrit' />
    <add val='0' order='0x40' stat='accCombat' />
    <set val='379' order='0x08' stat='pAtkSpd' />
    <enchant val='0' order='0x0C' stat='pAtk' />
    <enchant val='0' order='0x0C' stat='mAtk' />
  </for>
</item>
</list>